{
  "controller": {
    "catalog": "cubbies/kody-w/catalog/controller-catalog.json",
    "path": "cubbies/kody-w/agents/rapp_stack_cubby_agent.py",
    "sha256": "6318e300813e5f749ffbe030cc9a9f51ddef3c15657b947a72dd804eb5ceeef7",
    "streamable_agent_count": 1
  },
  "created_at": "2026-07-12T18:18:52Z",
  "display_name": "Kody Wildfeuer",
  "estate": {
    "anatomy": [
      "agents",
      "organs",
      "senses",
      "rapplications",
      "neighborhoods",
      "eggs",
      "show-and-tell"
    ]
  },
  "github_login": "kody-w",
  "product_version": "0.1.0rc12",
  "schema": "rapp-cubby/1.0",
  "slug": "kody-w",
  "streamable": {
    "agents": true
  },
  "what_im_cooking": "A public shelf for the under-construction RAPP stack handoff."
}
